{
  "disclaimer": "simulation != production; canary is confirmatory",
  "report_version": "1.0",
  "advisor.schema_version": "1.0",
  "estimator": "l0_tape_splice",
  "evidence_ceiling": "cassette",
  "graph_identity": "70a594e1ab69bf53",
  "graph_completeness": 1.0,
  "graph_trust": "high",
  "tape_version": "1.0",
  "input_hash": "4a5779ec35280013",
  "recommendations": [
    {
      "node_id": "code_agent",
      "node_kind": "llm_reasoner",
      "det_class": "llm",
      "action": "ABSTAIN",
      "n": 14,
      "p_mode": 0.4286,
      "p_mode_lower": 0.2138,
      "schema_ok": 1.0,
      "failure_rate": 0.0,
      "estimator": "observational_l0_proxy",
      "reasons": [
        "n=14 < n_min=30"
      ],
      "disclaimer": "simulation != production; canary is confirmatory",
      "evidence_tier": "observational",
      "replay_status": "diverged",
      "mixed": false,
      "cost_tokens": 118.0,
      "latency_ms": 195.0,
      "auditability": 0.0,
      "task_success": null,
      "policy_ok": null,
      "deltas": [],
      "interaction_hypotheses": []
    },
    {
      "node_id": "code_exec",
      "node_kind": "deterministic_tool",
      "det_class": "deterministic",
      "action": "ABSTAIN",
      "n": 8,
      "p_mode": 1.0,
      "p_mode_lower": 0.6756,
      "schema_ok": 1.0,
      "failure_rate": 0.0,
      "estimator": "l0_tape_splice",
      "reasons": [
        "n=8 < n_min=30"
      ],
      "disclaimer": "simulation != production; canary is confirmatory",
      "evidence_tier": "cassette",
      "replay_status": "tail_stable",
      "mixed": false,
      "cost_tokens": 0.0,
      "latency_ms": 8.0,
      "auditability": 1.0,
      "task_success": null,
      "policy_ok": null,
      "deltas": [],
      "interaction_hypotheses": []
    },
    {
      "node_id": "data_agent",
      "node_kind": "llm_reasoner",
      "det_class": "llm",
      "action": "ABSTAIN",
      "n": 8,
      "p_mode": 0.5,
      "p_mode_lower": 0.2152,
      "schema_ok": 1.0,
      "failure_rate": 0.0,
      "estimator": "observational_l0_proxy",
      "reasons": [
        "n=8 < n_min=30"
      ],
      "disclaimer": "simulation != production; canary is confirmatory",
      "evidence_tier": "observational",
      "replay_status": "diverged",
      "mixed": false,
      "cost_tokens": 118.0,
      "latency_ms": 195.0,
      "auditability": 0.0,
      "task_success": null,
      "policy_ok": null,
      "deltas": [],
      "interaction_hypotheses": []
    },
    {
      "node_id": "mcp_arxiv",
      "node_kind": "deterministic_tool",
      "det_class": "deterministic",
      "action": "ABSTAIN",
      "n": 7,
      "p_mode": 1.0,
      "p_mode_lower": 0.6457,
      "schema_ok": 1.0,
      "failure_rate": 0.0,
      "estimator": "l0_tape_splice",
      "reasons": [
        "n=7 < n_min=30"
      ],
      "disclaimer": "simulation != production; canary is confirmatory",
      "evidence_tier": "cassette",
      "replay_status": "tail_stable",
      "mixed": false,
      "cost_tokens": 0.0,
      "latency_ms": 25.0,
      "auditability": 1.0,
      "task_success": null,
      "policy_ok": null,
      "deltas": [],
      "interaction_hypotheses": []
    },
    {
      "node_id": "mcp_warehouse",
      "node_kind": "deterministic_tool",
      "det_class": "deterministic",
      "action": "ABSTAIN",
      "n": 4,
      "p_mode": 1.0,
      "p_mode_lower": 0.5101,
      "schema_ok": 1.0,
      "failure_rate": 0.0,
      "estimator": "l0_tape_splice",
      "reasons": [
        "n=4 < n_min=30"
      ],
      "disclaimer": "simulation != production; canary is confirmatory",
      "evidence_tier": "cassette",
      "replay_status": "tail_stable",
      "mixed": false,
      "cost_tokens": 0.0,
      "latency_ms": 25.0,
      "auditability": 1.0,
      "task_success": null,
      "policy_ok": null,
      "deltas": [],
      "interaction_hypotheses": []
    },
    {
      "node_id": "research_agent",
      "node_kind": "llm_reasoner",
      "det_class": "llm",
      "action": "ABSTAIN",
      "n": 18,
      "p_mode": 0.3889,
      "p_mode_lower": 0.203,
      "schema_ok": 1.0,
      "failure_rate": 0.0,
      "estimator": "observational_l0_proxy",
      "reasons": [
        "n=18 < n_min=30"
      ],
      "disclaimer": "simulation != production; canary is confirmatory",
      "evidence_tier": "observational",
      "replay_status": "diverged",
      "mixed": false,
      "cost_tokens": 100.5,
      "latency_ms": 165.8333,
      "auditability": 0.0,
      "task_success": null,
      "policy_ok": null,
      "deltas": [],
      "interaction_hypotheses": []
    },
    {
      "node_id": "skill_lint",
      "node_kind": "deterministic_tool",
      "det_class": "deterministic",
      "action": "ABSTAIN",
      "n": 6,
      "p_mode": 1.0,
      "p_mode_lower": 0.6097,
      "schema_ok": 1.0,
      "failure_rate": 0.0,
      "estimator": "l0_tape_splice",
      "reasons": [
        "n=6 < n_min=30"
      ],
      "disclaimer": "simulation != production; canary is confirmatory",
      "evidence_tier": "cassette",
      "replay_status": "tail_stable",
      "mixed": false,
      "cost_tokens": 0.0,
      "latency_ms": 25.0,
      "auditability": 1.0,
      "task_success": null,
      "policy_ok": null,
      "deltas": [],
      "interaction_hypotheses": []
    },
    {
      "node_id": "sql_query",
      "node_kind": "deterministic_tool",
      "det_class": "deterministic",
      "action": "ABSTAIN",
      "n": 4,
      "p_mode": 1.0,
      "p_mode_lower": 0.5101,
      "schema_ok": 1.0,
      "failure_rate": 0.0,
      "estimator": "l0_tape_splice",
      "reasons": [
        "n=4 < n_min=30"
      ],
      "disclaimer": "simulation != production; canary is confirmatory",
      "evidence_tier": "cassette",
      "replay_status": "tail_stable",
      "mixed": false,
      "cost_tokens": 0.0,
      "latency_ms": 8.0,
      "auditability": 1.0,
      "task_success": null,
      "policy_ok": null,
      "deltas": [],
      "interaction_hypotheses": []
    },
    {
      "node_id": "supervisor_gate",
      "node_kind": "llm_reasoner",
      "det_class": "llm",
      "action": "FlipToDet",
      "n": 40,
      "p_mode": 1.0,
      "p_mode_lower": 0.9124,
      "schema_ok": 1.0,
      "failure_rate": 0.0,
      "estimator": "l0_tape_splice",
      "reasons": [
        "schema_ok=1.00 >= 0.8",
        "p_mode=1.00 (wilson_lower=0.91) >= 0.7",
        "L0 splice tail_stable"
      ],
      "disclaimer": "simulation != production; canary is confirmatory",
      "evidence_tier": "cassette",
      "replay_status": "tail_stable",
      "mixed": false,
      "cost_tokens": 12.0,
      "latency_ms": 8.0,
      "auditability": 0.0,
      "task_success": null,
      "policy_ok": null,
      "deltas": [
        "auditability: llm logs -> deterministic function",
        "cost_tokens estimated -12.0 per call",
        "latency_ms estimated -8.0 model wait"
      ],
      "interaction_hypotheses": []
    },
    {
      "node_id": "task_router",
      "node_kind": "llm_reasoner",
      "det_class": "llm",
      "action": "ABSTAIN",
      "n": 40,
      "p_mode": 0.225,
      "p_mode_lower": 0.1232,
      "schema_ok": 1.0,
      "failure_rate": 0.0,
      "estimator": "observational_l0_proxy",
      "reasons": [
        "no rule fired with a CI that excludes the threshold"
      ],
      "disclaimer": "simulation != production; canary is confirmatory",
      "evidence_tier": "observational",
      "replay_status": "diverged",
      "mixed": false,
      "cost_tokens": 32.0,
      "latency_ms": 35.0,
      "auditability": 0.0,
      "task_success": null,
      "policy_ok": null,
      "deltas": [],
      "interaction_hypotheses": []
    },
    {
      "node_id": "web_search",
      "node_kind": "retriever",
      "det_class": "stochastic_index",
      "action": "ABSTAIN",
      "n": 6,
      "p_mode": 1.0,
      "p_mode_lower": 0.6097,
      "schema_ok": 1.0,
      "failure_rate": 0.0,
      "estimator": "l0_tape_splice",
      "reasons": [
        "n=6 < n_min=30"
      ],
      "disclaimer": "simulation != production; canary is confirmatory",
      "evidence_tier": "cassette",
      "replay_status": "tail_stable",
      "mixed": false,
      "cost_tokens": 0.0,
      "latency_ms": 8.0,
      "auditability": 1.0,
      "task_success": null,
      "policy_ok": null,
      "deltas": [],
      "interaction_hypotheses": []
    }
  ],
  "canary": [
    "shadow the candidate function on the same traffic",
    "compare outcome vector: failure, cost, latency, variance, policy",
    "promote only if intervals and safety gates pass; else ABSTAIN/demote",
    "simulation != production"
  ]
}
